{
  "schema_version": "pallet_vlm_request_v1",
  "request_id": "DC_00277",
  "state_hash": "1ee939fa23857f39f8fed85ed56adb135710d20db540c9a2308954b0a53d597d",
  "instruction_text": "电子产品箱应尽量集中码放。",
  "container": {
    "container_id": "P1210-H085",
    "length_mm": 1200,
    "width_mm": 1000,
    "max_height_mm": 850,
    "max_payload_kg": 1000.0,
    "coordinate_frame": "container_bottom_center"
  },
  "placed_items": [
    {
      "item_id": "item_01",
      "geometry_id": "G_400x300x160",
      "dimensions_mm": {
        "length": 400,
        "width": 300,
        "height": 160
      },
      "mass_kg": 5.342,
      "weight_class": "light",
      "material": "Metal",
      "fragile": false,
      "stackable": true,
      "top_load_limit_kg_synthetic": 46.08,
      "product_category": "electronics",
      "pose": {
        "x_mm": -400.0,
        "y_mm": 350.0,
        "z_base_mm": 0.0,
        "yaw_deg": 0
      },
      "oriented_size_mm": [
        400.0,
        300.0,
        160.0
      ],
      "supported_load_kg": 0.0,
      "support_fractions": []
    }
  ],
  "available_items": [
    {
      "item_id": "item_02",
      "geometry_id": "G_590x390x270",
      "dimensions_mm": {
        "length": 590,
        "width": 390,
        "height": 270
      },
      "mass_kg": 6.78,
      "weight_class": "medium",
      "material": "Cardboard",
      "fragile": false,
      "stackable": false,
      "top_load_limit_kg_synthetic": 38.83,
      "product_category": "electronics"
    }
  ],
  "candidates": [
    {
      "display_label": "C01",
      "candidate_id": "cand_f5cee7c40c39",
      "pick_item_id": "item_02",
      "pose": {
        "x_mm": 305.0,
        "y_mm": 305.0,
        "z_base_mm": 0.0,
        "yaw_deg": 0
      },
      "oriented_size_mm": [
        590,
        390,
        270
      ],
      "support": {
        "support_item_ids": [],
        "support_ratio": 1.0,
        "com_margin_mm": 195.0
      },
      "load": {
        "downward_load_kg": 0.0,
        "minimum_remaining_capacity_kg": null
      },
      "resulting_geometry": {
        "max_height_mm": 270.0,
        "volume_utilization": 0.079732,
        "center_of_mass_offset_mm": 324.881
      },
      "geometry_score_components": {
        "compactness": 0.643613,
        "height": 0.682353,
        "stability": 1.0,
        "balance": 0.584033
      }
    },
    {
      "display_label": "C02",
      "candidate_id": "cand_bd6a32385af2",
      "pick_item_id": "item_02",
      "pose": {
        "x_mm": 95.0,
        "y_mm": 305.0,
        "z_base_mm": 0.0,
        "yaw_deg": 0
      },
      "oriented_size_mm": [
        590,
        390,
        270
      ],
      "support": {
        "support_item_ids": [],
        "support_ratio": 1.0,
        "com_margin_mm": 195.0
      },
      "load": {
        "downward_load_kg": 0.0,
        "minimum_remaining_capacity_kg": null
      },
      "resulting_geometry": {
        "max_height_mm": 270.0,
        "volume_utilization": 0.079732,
        "center_of_mass_offset_mm": 347.388
      },
      "geometry_score_components": {
        "compactness": 0.780138,
        "height": 0.682353,
        "stability": 1.0,
        "balance": 0.555215
      }
    },
    {
      "display_label": "C03",
      "candidate_id": "cand_41c7edf645e8",
      "pick_item_id": "item_02",
      "pose": {
        "x_mm": 305.0,
        "y_mm": 5.0,
        "z_base_mm": 0.0,
        "yaw_deg": 0
      },
      "oriented_size_mm": [
        590,
        390,
        270
      ],
      "support": {
        "support_item_ids": [],
        "support_ratio": 1.0,
        "com_margin_mm": 195.0
      },
      "load": {
        "downward_load_kg": 0.0,
        "minimum_remaining_capacity_kg": null
      },
      "resulting_geometry": {
        "max_height_mm": 270.0,
        "volume_utilization": 0.079732,
        "center_of_mass_offset_mm": 157.14
      },
      "geometry_score_components": {
        "compactness": 0.363782,
        "height": 0.682353,
        "stability": 1.0,
        "balance": 0.798803
      }
    },
    {
      "display_label": "C04",
      "candidate_id": "cand_d90c4c5e3998",
      "pick_item_id": "item_02",
      "pose": {
        "x_mm": 95.0,
        "y_mm": -305.0,
        "z_base_mm": 0.0,
        "yaw_deg": 0
      },
      "oriented_size_mm": [
        590,
        390,
        270
      ],
      "support": {
        "support_item_ids": [],
        "support_ratio": 1.0,
        "com_margin_mm": 195.0
      },
      "load": {
        "downward_load_kg": 0.0,
        "minimum_remaining_capacity_kg": null
      },
      "resulting_geometry": {
        "max_height_mm": 270.0,
        "volume_utilization": 0.079732,
        "center_of_mass_offset_mm": 124.221
      },
      "geometry_score_components": {
        "compactness": 0.304254,
        "height": 0.682353,
        "stability": 1.0,
        "balance": 0.840952
      }
    },
    {
      "display_label": "C05",
      "candidate_id": "cand_f73ff40dfb79",
      "pick_item_id": "item_02",
      "pose": {
        "x_mm": 95.0,
        "y_mm": 5.0,
        "z_base_mm": 0.0,
        "yaw_deg": 0
      },
      "oriented_size_mm": [
        590,
        390,
        270
      ],
      "support": {
        "support_item_ids": [],
        "support_ratio": 1.0,
        "com_margin_mm": 195.0
      },
      "load": {
        "downward_load_kg": 0.0,
        "minimum_remaining_capacity_kg": null
      },
      "resulting_geometry": {
        "max_height_mm": 270.0,
        "volume_utilization": 0.079732,
        "center_of_mass_offset_mm": 199.559
      },
      "geometry_score_components": {
        "compactness": 0.440947,
        "height": 0.682353,
        "stability": 1.0,
        "balance": 0.74449
      }
    },
    {
      "display_label": "C06",
      "candidate_id": "cand_64746593be5a",
      "pick_item_id": "item_02",
      "pose": {
        "x_mm": 405.0,
        "y_mm": 205.0,
        "z_base_mm": 0.0,
        "yaw_deg": 90
      },
      "oriented_size_mm": [
        390,
        590,
        270
      ],
      "support": {
        "support_item_ids": [],
        "support_ratio": 1.0,
        "com_margin_mm": 195.0
      },
      "load": {
        "downward_load_kg": 0.0,
        "minimum_remaining_capacity_kg": null
      },
      "resulting_geometry": {
        "max_height_mm": 270.0,
        "volume_utilization": 0.079732,
        "center_of_mass_offset_mm": 273.554
      },
      "geometry_score_components": {
        "compactness": 0.425439,
        "height": 0.682353,
        "stability": 1.0,
        "balance": 0.64975
      }
    },
    {
      "display_label": "C07",
      "candidate_id": "cand_c816a2ec50af",
      "pick_item_id": "item_02",
      "pose": {
        "x_mm": -305.0,
        "y_mm": 5.0,
        "z_base_mm": 0.0,
        "yaw_deg": 0
      },
      "oriented_size_mm": [
        590,
        390,
        270
      ],
      "support": {
        "support_item_ids": [],
        "support_ratio": 1.0,
        "com_margin_mm": 195.0
      },
      "load": {
        "downward_load_kg": 0.0,
        "minimum_remaining_capacity_kg": null
      },
      "resulting_geometry": {
        "max_height_mm": 270.0,
        "volume_utilization": 0.079732,
        "center_of_mass_offset_mm": 380.757
      },
      "geometry_score_components": {
        "compactness": 0.739895,
        "height": 0.682353,
        "stability": 1.0,
        "balance": 0.51249
      }
    },
    {
      "display_label": "C08",
      "candidate_id": "cand_7f5489980629",
      "pick_item_id": "item_02",
      "pose": {
        "x_mm": -5.0,
        "y_mm": -205.0,
        "z_base_mm": 0.0,
        "yaw_deg": 90
      },
      "oriented_size_mm": [
        390,
        590,
        270
      ],
      "support": {
        "support_item_ids": [],
        "support_ratio": 1.0,
        "com_margin_mm": 195.0
      },
      "load": {
        "downward_load_kg": 0.0,
        "minimum_remaining_capacity_kg": null
      },
      "resulting_geometry": {
        "max_height_mm": 270.0,
        "volume_utilization": 0.079732,
        "center_of_mass_offset_mm": 183.393
      },
      "geometry_score_components": {
        "compactness": 0.38128,
        "height": 0.682353,
        "stability": 1.0,
        "balance": 0.765189
      }
    },
    {
      "display_label": "C09",
      "candidate_id": "cand_069ea09c669e",
      "pick_item_id": "item_02",
      "pose": {
        "x_mm": -305.0,
        "y_mm": -305.0,
        "z_base_mm": 0.0,
        "yaw_deg": 0
      },
      "oriented_size_mm": [
        590,
        390,
        270
      ],
      "support": {
        "support_item_ids": [],
        "support_ratio": 1.0,
        "com_margin_mm": 195.0
      },
      "load": {
        "downward_load_kg": 0.0,
        "minimum_remaining_capacity_kg": null
      },
      "resulting_geometry": {
        "max_height_mm": 270.0,
        "volume_utilization": 0.079732,
        "center_of_mass_offset_mm": 347.25
      },
      "geometry_score_components": {
        "compactness": 0.510527,
        "height": 0.682353,
        "stability": 1.0,
        "balance": 0.555391
      }
    },
    {
      "display_label": "C10",
      "candidate_id": "cand_7dfef0453db0",
      "pick_item_id": "item_02",
      "pose": {
        "x_mm": -5.0,
        "y_mm": 205.0,
        "z_base_mm": 0.0,
        "yaw_deg": 90
      },
      "oriented_size_mm": [
        390,
        590,
        270
      ],
      "support": {
        "support_item_ids": [],
        "support_ratio": 1.0,
        "com_margin_mm": 195.0
      },
      "load": {
        "downward_load_kg": 0.0,
        "minimum_remaining_capacity_kg": null
      },
      "resulting_geometry": {
        "max_height_mm": 270.0,
        "volume_utilization": 0.079732,
        "center_of_mass_offset_mm": 323.069
      },
      "geometry_score_components": {
        "compactness": 0.646237,
        "height": 0.682353,
        "stability": 1.0,